Name,Date,Property,Property 1,Tags
JavaScript: Memory management + how to handle 4 common memory leaks,"Dec 18, 2020 12:23 AM",https://blog.sessionstack.com/how-javascript-works-memory-management-how-to-handle-4-common-memory-leaks-3f28b94cfbec,,"Javascript, Log, Notes, Study"
JavaScript: The mechanics of Web Push Notifications,"Dec 18, 2020 12:21 AM",https://blog.sessionstack.com/how-javascript-works-the-mechanics-of-web-push-notifications-290176c5c55d,,"Javascript, Log, Notes, Study"
"JavaScript: Service Workers, their lifecycle and use cases","Dec 18, 2020 12:18 AM",https://blog.sessionstack.com/how-javascript-works-service-workers-their-life-cycle-and-use-cases-52b19ad98b58,,"Javascript, Log, Notes, Study"
JavaScript: Web Workers,"Dec 18, 2020 12:11 AM",https://blog.sessionstack.com/how-javascript-works-the-building-blocks-of-web-workers-5-cases-when-you-should-use-them-a547c0757f6a,,"Log, Study"
JavaScript: WebAssembly,"Dec 18, 2020 12:15 AM",https://blog.sessionstack.com/how-javascript-works-a-comparison-with-webassembly-why-in-certain-cases-its-better-to-use-it-d80945172d79,,"Javascript, Log, Notes, Study"
JavaScript: Tracking changes in the DOM using MutationObserver,"Dec 18, 2020 12:53 PM",https://blog.sessionstack.com/how-javascript-works-tracking-changes-in-the-dom-using-mutationobserver-86adc7446401,,"Javascript, Notes, Study"
JavaScript: Under the hood of CSS and JS animations + how to optimize their performance,"Dec 18, 2020 1:21 PM",https://blog.sessionstack.com/how-javascript-works-the-rendering-engine-and-tips-to-optimize-its-performance-7b95553baeda,,"Javascript, Notes, Study, important"
JavaScript: Inside the Networking Layer + How to Optimize Its Performance and Security,"Dec 18, 2020 1:40 PM",https://blog.sessionstack.com/how-javascript-works-inside-the-networking-layer-how-to-optimize-its-performance-and-security-f71b7414d34c,,"Javascript, Notes, Study"
Notes,"Dec 18, 2020 1:19 PM",,,"Javascript, Notes, Study"